{
  "id": "RELATIONSHIP-SET-10001",
  "title": "Seed RAG Technique Relationships",
  "description": "Conservative declared relationships among the seed RAG technique records. These relationships describe possible pipeline composition in the seed dataset and do not state that every RAG system uses this sequence.",
  "relationships": [
    {
      "id": "RELATIONSHIP-10001",
      "predicate": "CAN_PRECEDE_IN_PIPELINE",
      "sourceId": "TECHNIQUE-10002",
      "targetId": "TECHNIQUE-10001",
      "sourceDataFile": "data/rag-techniques/query-rewriting.json",
      "targetDataFile": "data/rag-techniques/hybrid-retrieval.json",
      "relationshipKind": "Domain Relationship",
      "description": "Query Rewriting can precede Hybrid Retrieval in a RAG pipeline when a system rewrites a user query before retrieval.",
      "properties": {
        "confidence": "Conservative",
        "edgeKind": "Domain Relationship",
        "scope": "Seed Dataset",
        "status": "Draft"
      }
    },
    {
      "id": "RELATIONSHIP-10002",
      "predicate": "CAN_PROVIDE_CANDIDATES_TO",
      "sourceId": "TECHNIQUE-10001",
      "targetId": "TECHNIQUE-10003",
      "sourceDataFile": "data/rag-techniques/hybrid-retrieval.json",
      "targetDataFile": "data/rag-techniques/reranking.json",
      "relationshipKind": "Domain Relationship",
      "description": "Hybrid Retrieval can provide candidate results to Reranking when a pipeline applies a later ranking step to retrieved candidates.",
      "properties": {
        "confidence": "Conservative",
        "edgeKind": "Domain Relationship",
        "scope": "Seed Dataset",
        "status": "Draft"
      }
    },
    {
      "id": "RELATIONSHIP-10003",
      "predicate": "CAN_REFINE_RESULTS_FROM",
      "sourceId": "TECHNIQUE-10003",
      "targetId": "TECHNIQUE-10001",
      "sourceDataFile": "data/rag-techniques/reranking.json",
      "targetDataFile": "data/rag-techniques/hybrid-retrieval.json",
      "relationshipKind": "Domain Relationship",
      "description": "Reranking can refine candidate results returned by Hybrid Retrieval when a pipeline reranks the retrieved candidate set before context assembly.",
      "properties": {
        "confidence": "Conservative",
        "edgeKind": "Domain Relationship",
        "scope": "Seed Dataset",
        "status": "Draft"
      }
    },
    {
      "id": "RELATIONSHIP-10004",
      "predicate": "CAN_PRECEDE_IN_PIPELINE",
      "sourceId": "TECHNIQUE-10004",
      "targetId": "TECHNIQUE-10001",
      "sourceDataFile": "data/rag-techniques/fixed-size-chunking.json",
      "targetDataFile": "data/rag-techniques/hybrid-retrieval.json",
      "relationshipKind": "Domain Relationship",
      "description": "Fixed-Size Chunking can precede Hybrid Retrieval when a RAG pipeline prepares source content as chunks before retrieval-oriented processing, without making this ordering mandatory or sufficient for better retrieval quality.",
      "properties": {
        "confidence": "Conservative",
        "edgeKind": "Domain Relationship",
        "scope": "Seed Dataset",
        "status": "Draft"
      }
    },
    {
      "id": "RELATIONSHIP-10005",
      "predicate": "CAN_PRECEDE_IN_PIPELINE",
      "sourceId": "TECHNIQUE-10005",
      "targetId": "TECHNIQUE-10001",
      "sourceDataFile": "data/rag-techniques/recursive-chunking.json",
      "targetDataFile": "data/rag-techniques/hybrid-retrieval.json",
      "relationshipKind": "Domain Relationship",
      "description": "Recursive Chunking can precede Hybrid Retrieval when a RAG pipeline prepares source content as structure-aware chunks before retrieval-oriented processing, without making this ordering mandatory or sufficient for better retrieval quality.",
      "properties": {
        "confidence": "Conservative",
        "edgeKind": "Domain Relationship",
        "scope": "Seed Dataset",
        "status": "Draft"
      }
    },
    {
      "id": "RELATIONSHIP-10006",
      "predicate": "CAN_PRECEDE_IN_PIPELINE",
      "sourceId": "TECHNIQUE-10006",
      "targetId": "TECHNIQUE-10001",
      "sourceDataFile": "data/rag-techniques/semantic-chunking.json",
      "targetDataFile": "data/rag-techniques/hybrid-retrieval.json",
      "relationshipKind": "Domain Relationship",
      "description": "Semantic Chunking can precede Hybrid Retrieval when a RAG pipeline prepares source content as meaning-oriented chunks before retrieval-oriented processing, without making this ordering mandatory or sufficient for better retrieval quality.",
      "properties": {
        "confidence": "Conservative",
        "edgeKind": "Domain Relationship",
        "scope": "Seed Dataset",
        "status": "Draft"
      }
    }
  ]
}
